{
  "hypothesis_set_id": "HS-DEMO-001",
  "version": 1,
  "opportunity_ref": "O-DEMO-001",
  "owner": "human:product-lead",
  "review_at": "2030-07-20T12:00:00Z",
  "hypotheses": [
    {
      "hypothesis_id": "H-PROBLEM-001",
      "rank": 1,
      "type": "problem",
      "statement": "Product leads using coding agents need an enforceable business-readiness handoff before implementation begins.",
      "why_it_matters": "If approvals in chat are already sufficient, a governance workflow adds friction without value.",
      "falsification_condition": "Fewer than three of five target users can identify a recent premature-build failure or would use a bounded handoff.",
      "evidence_threshold": {
        "metric": "Target users reporting both a recent failure and intent to use the workflow",
        "aggregation": "sum",
        "operator": ">=",
        "target": 3,
        "unit": "of 5 interviews",
        "minimum_evidence_items": 2,
        "required_source_types": ["customer_interview"]
      },
      "kill_or_pivot_trigger": {
        "action": "pivot",
        "condition": "The evidence threshold is missed after five independent target-user interviews.",
        "reason_code": "TARGET_USER_NEED_NOT_SUPPORTED"
      },
      "status": "testing",
      "evidence_refs": ["E-INTERVIEW-A", "E-INTERVIEW-B"],
      "confidence": {
        "score": 55,
        "scale": "0-100",
        "rationale": "The scenario includes two labeled fixtures, not real market validation."
      },
      "owner": "human:product-lead",
      "review_at": "2030-07-20T12:00:00Z"
    }
  ],
  "created_at": "2026-07-17T12:00:00Z",
  "updated_at": "2026-07-17T12:00:00Z"
}
